{
  "$schema": "https://json-schema.org/draft/2020-12/schema",
  "$id": "https://boltverse.odyssey/ticket.v1.schema.json",
  "title": "ticket.v1",
  "description": "Per-object build ticket. Fill in order: plates, placement (with budget), build, gates, play, shots, phone, go. Each field blocks the next. When HEAD moves past build.commit, reset gates, play, shots, and phone to pending. Do not wipe plates, placement, or build.",
  "type": "object",
  "additionalProperties": false,
  "required": ["schema", "plates", "placement", "build", "gates", "play", "shots", "phone", "go"],
  "properties": {
    "schema": { "const": "ticket.v1" },
    "object_id": { "type": "string", "minLength": 1 },
    "plates": { "$ref": "#/$defs/plates" },
    "placement": { "$ref": "#/$defs/placement" },
    "build": { "$ref": "#/$defs/build" },
    "gates": { "$ref": "#/$defs/gates" },
    "play": { "$ref": "#/$defs/play" },
    "shots": { "$ref": "#/$defs/shots" },
    "phone": { "$ref": "#/$defs/phone" },
    "go": { "$ref": "#/$defs/go" }
  },
  "$defs": {
    "sha": {
      "type": "string",
      "pattern": "^[0-9a-fA-F]{7,40}$"
    },
    "pending": { "const": "pending" },
    "plate": {
      "type": "object",
      "additionalProperties": false,
      "required": ["id", "path", "ad_precheck"],
      "properties": {
        "id": { "type": "string", "minLength": 1 },
        "path": { "type": "string", "minLength": 1 },
        "ad_precheck": { "enum": ["KEEP", "FAIL", "pending"] },
        "notes": { "type": "string" }
      }
    },
    "plates": {
      "description": "Art Director pre-check. The field passes only when every plate is KEEP.",
      "oneOf": [
        { "$ref": "#/$defs/pending" },
        { "type": "array", "items": { "$ref": "#/$defs/plate" } }
      ]
    },
    "placement": {
      "description": "Level Designer placement, filled before build. ground_m must be 0.",
      "oneOf": [
        { "$ref": "#/$defs/pending" },
        {
          "type": "object",
          "additionalProperties": false,
          "required": ["path", "min_clearances", "ground_m", "colliders", "budget"],
          "properties": {
            "path": {
              "description": "Route or spine refs.",
              "oneOf": [
                { "type": "string", "minLength": 1 },
                {
                  "type": "array",
                  "minItems": 1,
                  "items": { "type": "string", "minLength": 1 }
                }
              ]
            },
            "min_clearances": {
              "type": "object",
              "additionalProperties": { "type": "number", "minimum": 0 },
              "required": ["headroom_m", "width_m"],
              "properties": {
                "headroom_m": { "type": "number", "minimum": 0 },
                "width_m": { "type": "number", "minimum": 0 }
              }
            },
            "ground_m": {
              "type": "number",
              "description": "Must be 0. The validator fails placement and gates otherwise."
            },
            "colliders": {
              "type": "array",
              "items": { "type": "string", "minLength": 1 }
            },
            "budget": { "$ref": "#/$defs/budget" }
          }
        }
      ]
    },
    "budget": {
      "type": "object",
      "additionalProperties": false,
      "required": ["lod0_tri_cap", "texture_mb_share"],
      "description": "lod0_tri_cap is a triangle count (a pillar is at or under 25000). texture_mb_share is this object's megabyte share of the zone 300 MB pool.",
      "properties": {
        "lod0_tri_cap": { "type": "number", "minimum": 0 },
        "texture_mb_share": { "type": "number", "minimum": 0 }
      }
    },
    "build": {
      "description": "Object build commit. Full sha or a 7+ hex abbreviation.",
      "oneOf": [
        { "$ref": "#/$defs/pending" },
        {
          "type": "object",
          "additionalProperties": false,
          "required": ["commit"],
          "properties": {
            "commit": { "$ref": "#/$defs/sha" }
          }
        }
      ]
    },
    "clearance": {
      "type": "object",
      "additionalProperties": false,
      "required": ["measured"],
      "properties": {
        "measured": {
          "type": "object",
          "additionalProperties": false,
          "required": ["headroom_m", "width_m", "ground_m"],
          "properties": {
            "headroom_m": { "type": "number" },
            "width_m": { "type": "number" },
            "ground_m": { "type": "number" }
          }
        }
      }
    },
    "budgetCheck": {
      "type": "object",
      "additionalProperties": false,
      "required": ["lod0_tris", "texture_mb"],
      "properties": {
        "lod0_tris": { "type": "number", "minimum": 0 },
        "texture_mb": { "type": "number", "minimum": 0 }
      }
    },
    "gates": {
      "description": "Runs only when build.commit and, once shots are stamped, shots.commit match HEAD. Fails on clearance or budget.",
      "oneOf": [
        { "$ref": "#/$defs/pending" },
        {
          "type": "object",
          "additionalProperties": false,
          "required": ["status", "commit", "object_gate", "clearance", "budget_check"],
          "properties": {
            "status": { "enum": ["pending", "pass", "fail", "refused"] },
            "commit": { "$ref": "#/$defs/sha" },
            "object_gate": {
              "description": "object-gate report JSON, or a path to that JSON. Read only. This tool does not call object-gate.",
              "oneOf": [
                { "type": "string", "minLength": 1 },
                { "type": "object" }
              ]
            },
            "clearance": { "$ref": "#/$defs/clearance" },
            "budget_check": { "$ref": "#/$defs/budgetCheck" }
          }
        }
      ]
    },
    "timecode": {
      "type": "object",
      "additionalProperties": false,
      "required": ["t", "note"],
      "properties": {
        "t": { "type": "number", "minimum": 0 },
        "note": { "type": "string" }
      }
    },
    "play": {
      "oneOf": [
        { "$ref": "#/$defs/pending" },
        {
          "type": "object",
          "additionalProperties": false,
          "required": ["status", "commit", "timecodes"],
          "properties": {
            "status": { "enum": ["KEEP", "FAIL", "pending"] },
            "commit": { "$ref": "#/$defs/sha" },
            "timecodes": { "type": "array", "items": { "$ref": "#/$defs/timecode" } },
            "notes": { "type": "string" }
          }
        }
      ]
    },
    "shots": {
      "description": "Shot sheet plus Art Director KEEP. Commit-stamped. Gates refuse when this commit is not HEAD.",
      "oneOf": [
        { "$ref": "#/$defs/pending" },
        {
          "type": "object",
          "additionalProperties": false,
          "required": ["status", "commit", "sheet_paths", "ad_verdict"],
          "properties": {
            "status": { "enum": ["KEEP", "FAIL", "pending"] },
            "commit": { "$ref": "#/$defs/sha" },
            "sheet_paths": {
              "type": "array",
              "minItems": 1,
              "items": { "type": "string", "minLength": 1 }
            },
            "ad_verdict": { "enum": ["KEEP", "FAIL", "pending"] }
          }
        }
      ]
    },
    "phone": {
      "description": "Commit-stamped. Empty of a measured fps result is status fps unverified. go accepts that status or pass.",
      "oneOf": [
        { "$ref": "#/$defs/pending" },
        {
          "type": "object",
          "additionalProperties": false,
          "required": ["status", "commit"],
          "properties": {
            "status": { "enum": ["fps unverified", "pass", "fail", "pending"] },
            "commit": { "$ref": "#/$defs/sha" },
            "perf_report": {
              "oneOf": [
                { "type": "string", "minLength": 1 },
                { "type": "object" }
              ]
            }
          }
        }
      ]
    },
    "go": {
      "description": "SmiR go. Allowed only when every prior field passes. phone may be fps unverified or pass.",
      "oneOf": [
        { "$ref": "#/$defs/pending" },
        {
          "type": "object",
          "additionalProperties": false,
          "required": ["text", "timestamp", "executed_by"],
          "properties": {
            "text": { "type": "string", "minLength": 1 },
            "timestamp": {
              "type": "string",
              "pattern": "^\\d{4}-\\d{2}-\\d{2}T\\d{2}:\\d{2}:\\d{2}(?:\\.\\d+)?(?:Z|[+-]\\d{2}:\\d{2})$"
            },
            "executed_by": { "const": "Director" }
          }
        }
      ]
    }
  }
}
