{
  "schema": "ticket.v1",
  "object_id": "fixture-pillar",
  "plates": [
    { "id": "pillar-front", "path": "fixture/plates/pillar-front.jpg", "ad_precheck": "KEEP" }
  ],
  "placement": {
    "path": ["spine/pillar"],
    "min_clearances": { "headroom_m": 2.2, "width_m": 1.2 },
    "ground_m": 0,
    "colliders": ["pillar-front"],
    "budget": { "lod0_tri_cap": 25000, "texture_mb_share": 12 }
  },
  "build": { "commit": "1111111111111111111111111111111111111111" },
  "gates": {
    "status": "pass",
    "commit": "1111111111111111111111111111111111111111",
    "object_gate": { "tool": "object-gate", "verdict": "PASS" },
    "clearance": {
      "measured": { "headroom_m": 2.2, "width_m": 1.2, "ground_m": 0 }
    },
    "budget_check": { "lod0_tris": 25000, "texture_mb": 12.01 }
  },
  "play": "pending",
  "shots": "pending",
  "phone": "pending",
  "go": "pending"
}
